{
  "schema_version": 1,
  "suite": "energy",
  "status": "ok",
  "started_at": "2026-10-30T07:47:59.483437Z",
  "finished_at": "2026-10-30T07:49:01.127584Z",
  "duration_ms": 61629,
  "harness_version": "0.0.1",
  "git_commit": "2f2153324b4e63ac134e657b5f2378a2d99cf093",
  "environment": {
    "os": "macos",
    "arch": "aarch64",
    "cpus": 5,
    "build_profile": "release"
  },
  "config": {
    "scale": "quick",
    "seed": 42,
    "params": {
      "attribution": "package energy is the whole machine's: each scenario with an energy source also meters an equal window with nothing launched (a11y_poll: its own sleeping window) and reports attributable = window minus baseline, as mean watts; noisy on shared VMs",
      "energy_source": "none",
      "energy_source.note": "powermetrics: no processor energy or power in its samples (virtual Mac?)",
      "local.chat": {
        "file": "Qwen3-1.7B-Q8_0.gguf",
        "id": "qwen3-1.7b-q8",
        "load_s": 3.85,
        "pending": false,
        "pending_file": null,
        "quantisation": "Q8_0",
        "revision": "90862c4b9d2787eaed51d12237eafdfe7c5f6077",
        "sha256": "061b54daade076b5d3362dac252678d17da8c68f07560be70818cace6590cb1a",
        "size_bytes": 1834426016
      },
      "local.hardware": {
        "arch": "aarch64",
        "cpu_model": "Apple M2 Pro (Virtual)",
        "gpu": "AppleSilicon",
        "logical_cores": 5,
        "meets_16gb": false,
        "os": "macos",
        "total_ram_gib": 14.0
      },
      "local.install_s": 41.4,
      "local.runtime": "llama-server-macos-aarch64-metal (b11940)",
      "local.thinking": "off",
      "prefill": "measured",
      "prefill.draft_local_budget": "on",
      "prefill.energy_note": "powermetrics: no processor energy or power in its samples (virtual Mac?)",
      "prefill.energy_source": "none",
      "prefill.flow": "doubletap's drafters (draft fixture corpus, text-only retrieval), read-ahead on with min_interval_ms 0; Drafter::prewarm_idle and one read-ahead unmetered, then N read-aheads of distinct tasks back to back, each waited for, metered on llama-server",
      "prefill.model": "qwen3-1.7b-q8 (Qwen3-1.7B-Q8_0.gguf, local llama-server llama-server-macos-aarch64-metal (b11940), thinking off)",
      "prefill.process_source": "powermetrics",
      "prefill.processes": 1,
      "prefill.read_aheads": 4,
      "prefill.seed": 42,
      "prefill.temperature": 0.0,
      "prefill.window_s": 10.604,
      "sample_interval_s": 1.0,
      "scenarios": [
        "prefill"
      ],
      "settle_s": 12.0,
      "timeout_s": 300.0
    }
  },
  "metrics": [
    {
      "name": "energy.prefill.completed",
      "value": 4.0,
      "unit": "count",
      "direction": "info",
      "target": null,
      "target_met": null,
      "description": "Read-aheads that completed in the metered window"
    },
    {
      "name": "energy.prefill.skipped",
      "value": 0.0,
      "unit": "count",
      "direction": "lower_is_better",
      "target": null,
      "target_met": null,
      "description": "Read-aheads the drafter skipped"
    },
    {
      "name": "energy.prefill.timeouts",
      "value": 0.0,
      "unit": "count",
      "direction": "lower_is_better",
      "target": null,
      "target_met": null,
      "description": "Read-aheads that timed out"
    },
    {
      "name": "energy.prefill.seconds_per_read_ahead",
      "value": 2.6415,
      "unit": "s",
      "direction": "lower_is_better",
      "target": null,
      "target_met": null,
      "description": "Mean wall time of a completed read-ahead (prompt build, retrieval and prefill)"
    },
    {
      "name": "energy.prefill.cpu_s_per_read_ahead",
      "value": 12.478109192002645,
      "unit": "s",
      "direction": "lower_is_better",
      "target": null,
      "target_met": null,
      "description": "llama-server CPU time over the metered window per completed read-ahead"
    },
    {
      "name": "energy.prefill.wakeups_per_read_ahead",
      "value": 99.10777909847923,
      "unit": "count",
      "direction": "info",
      "target": null,
      "target_met": null,
      "description": "llama-server wakeups per completed read-ahead"
    },
    {
      "name": "energy.prefill.energy_impact",
      "value": 470.714413026738,
      "unit": "score/s",
      "direction": "lower_is_better",
      "target": null,
      "target_met": null,
      "description": "macOS energy impact of the read-aheads per second (powermetrics tasks, unitless)"
    }
  ],
  "message": null
}
