{
  "schema_version": 1,
  "suite": "energy",
  "status": "ok",
  "started_at": "2026-10-30T07:49:09.866304873Z",
  "finished_at": "2026-10-30T07:51:03.111180448Z",
  "duration_ms": 113244,
  "harness_version": "0.0.1",
  "git_commit": "2f2153324b4e63ac134e657b5f2378a2d99cf093",
  "environment": {
    "os": "linux",
    "arch": "x86_64",
    "cpus": 4,
    "build_profile": "release"
  },
  "config": {
    "scale": "quick",
    "seed": 42,
    "params": {
      "attribution": "package energy is the whole machine's: each scenario with an energy source also meters an equal window with nothing launched (a11y_poll: its own sleeping window) and reports attributable = window minus baseline, as mean watts; noisy on shared VMs",
      "energy_source": "none",
      "energy_source.note": "rapl: no intel-rapl package zones in /sys/class/powercap (VM or unsupported CPU)",
      "local.chat": {
        "file": "Qwen3-4B-Q4_K_M.gguf",
        "id": "qwen3-4b-q4km",
        "load_s": 3.77,
        "pending": false,
        "pending_file": null,
        "quantisation": "Q4_K_M",
        "revision": "bc640142c66e1fdd12af0bd68f40445458f3869b",
        "sha256": "7485fe6f11af29433bc51cab58009521f205840f5b4ae3a32fa7f92e8534fdf5",
        "size_bytes": 2497280256
      },
      "local.hardware": {
        "arch": "x86_64",
        "cpu_model": "AMD EPYC 9V74 80-Core Processor",
        "gpu": "Unknown",
        "logical_cores": 4,
        "meets_16gb": true,
        "os": "linux",
        "total_ram_gib": 15.6
      },
      "local.install_s": 33.86,
      "local.runtime": "llama-server-linux-x86_64-cpu (b11940)",
      "local.thinking": "off",
      "prefill": "measured",
      "prefill.draft_local_budget": "on",
      "prefill.energy_note": "rapl: no intel-rapl package zones in /sys/class/powercap (VM or unsupported CPU)",
      "prefill.energy_source": "none",
      "prefill.flow": "doubletap's drafters (draft fixture corpus, text-only retrieval), read-ahead on with min_interval_ms 0; Drafter::prewarm_idle and one read-ahead unmetered, then N read-aheads of distinct tasks back to back, each waited for, metered on llama-server",
      "prefill.model": "qwen3-4b-q4km (Qwen3-4B-Q4_K_M.gguf, local llama-server llama-server-linux-x86_64-cpu (b11940), thinking off)",
      "prefill.process_source": "proc",
      "prefill.processes": 1,
      "prefill.read_aheads": 4,
      "prefill.seed": 42,
      "prefill.temperature": 0.0,
      "prefill.window_s": 51.59,
      "sample_interval_s": 1.0,
      "scenarios": [
        "prefill"
      ],
      "settle_s": 12.0,
      "timeout_s": 300.0
    }
  },
  "metrics": [
    {
      "name": "energy.prefill.completed",
      "value": 4.0,
      "unit": "count",
      "direction": "info",
      "target": null,
      "target_met": null,
      "description": "Read-aheads that completed in the metered window"
    },
    {
      "name": "energy.prefill.skipped",
      "value": 0.0,
      "unit": "count",
      "direction": "lower_is_better",
      "target": null,
      "target_met": null,
      "description": "Read-aheads the drafter skipped"
    },
    {
      "name": "energy.prefill.timeouts",
      "value": 0.0,
      "unit": "count",
      "direction": "lower_is_better",
      "target": null,
      "target_met": null,
      "description": "Read-aheads that timed out"
    },
    {
      "name": "energy.prefill.seconds_per_read_ahead",
      "value": 12.897,
      "unit": "s",
      "direction": "lower_is_better",
      "target": null,
      "target_met": null,
      "description": "Mean wall time of a completed read-ahead (prompt build, retrieval and prefill)"
    },
    {
      "name": "energy.prefill.cpu_s_per_read_ahead",
      "value": 25.73409623075,
      "unit": "s",
      "direction": "lower_is_better",
      "target": null,
      "target_met": null,
      "description": "llama-server CPU time over the metered window per completed read-ahead"
    },
    {
      "name": "energy.prefill.wakeups_per_read_ahead",
      "value": 133.5,
      "unit": "count",
      "direction": "info",
      "target": null,
      "target_met": null,
      "description": "llama-server wakeups per completed read-ahead"
    }
  ],
  "message": null
}
